"",名称,カナ,郵便番号,区,所在地_住所1,所在地_住所2,緯度,経度,電話,URL,運営者,開催曜日,開催時間,開催日時備考,対象者,利用料,定員,申込方法,活動内容
1,寺子屋かもえ,テラコヤカモエ,4328017,中区,浜松市中区三組町139-8,鴨江珈琲,34.70688272,137.721421,090-4113-1989,https://cafe-de-terakoya.or.jp/,特定非営利活動法人Cafe de寺子屋,水,18:00～20:00,※18：30までに参加者がいない場合、その日の開催は中止します。,小学1年生から高校3年生です。特別な条件はありません。,無料,8,"お申込みは必要ありません。ただ、定員が少ないので、メールにてご連絡いただけますと確実です。
info@cafe-de-terakoya.or.jp","カフェで大学生が小中高生の学びをサポートします！
寺子屋は、「地域でいちばん心地よく自学自習ができる場所」を目指しています。
寺子屋の大学生は、本人が本当に学びたいことについて学ぶこと・自分で考え発見することをお手伝いします。
みなさんのご参加お待ちしております！"
2,コトバショ,コトバショ,4328007,西区,浜松市西区神原町922,神久呂協働センター,34.733605,137.669432,053-485-0215,,浜松湖東高校（担当：江間、吉川）,,17:15～18:30 ,月2回,市内中学生,無料,30,"メールにてご連絡いただければ、申込用紙をお送りします。
 setsuko01.ema@edu.pref.shizuoka.jp",高校生が学習塾を運営します。湖東高校生徒が、中学生の学習を支援します。授業のわからないところや、受験勉強など、各自の教材で各自のペースに寄り添って教えます。
